{
  "$schema": "https://json-schema.org/draft/2020-12/schema",
  "type": "object",
  "additionalProperties": false,
  "properties": {
    "type": {
      "type": "array",
      "readOnly": true,
      "default": ["ConformityScheme"],
      "items": {
        "type": "string"
      },
      "allOf": [
        {
          "contains": {
            "const": "ConformityScheme",
            "minContains": 1
          }
        }
      ]
    },
    "id": {
      "example": "https://sample-scheme.org/lrap",
      "type": "string",
      "format": "uri",
      "description": "Globally unique identifier of this conformity scheme. Typically represented as a URI SchemeOwner/SchemeName URI"
    },
    "name": {
      "example": "Labour rights assessment program",
      "type": "string",
      "description": "Name of this scheme as defined by the scheme owner."
    },
    "description": {
      "type": "string",
      "description": "Description of this conformity scheme"
    },
    "owner": {
      "type": "object",
      "properties": {
        "type": {
          "type": "array",
          "readOnly": true,
          "default": ["Party"],
          "items": {
            "type": "string"
          },
          "allOf": [
            {
              "contains": {
                "const": "Party",
                "minContains": 1
              }
            }
          ]
        },
        "id": {
          "example": "https://sample-business-register.gov/123456789",
          "type": "string",
          "format": "uri",
          "description": "Globally unique identifier of this party. Typically represented as a URI identifierScheme/Identifier URI"
        },
        "name": {
          "example": "Sample Company Ltd",
          "type": "string",
          "description": "Legal registered name of this party."
        },
        "registeredId": {
          "example": 90664869327,
          "type": "string",
          "description": "The registration number (alphanumeric) of the Party within the register. Unique within the register."
        }
      },
      "required": ["id", "name"],
      "description": "The party that is the owner / maintainer of this conformity scheme."
    },
    "endorsementLevel": {
      "type": "string",
      "enum": [
        "endorsed_self",
        "endorsed_mandate",
        "endorsed_accreditation",
        "endorsed_benchmarked"
      ],
      "example": "endorsed_self",
      "description": "The scheme assurance type."
    },
    "endorsement": {
      "$ref": "#/$defs/Endorsement",
      "description": "The endorsement provided to the scheme by an external authority such as a regulator, an accreditaiton authority, or a benchmarking scheme."
    },
    "schemeScoringFramework": {
      "$ref": "#/$defs/ScoringFramework",
      "description": "The scheme level overall scoring framework that represents the achievement levels (AA, A, B etc) that maybe be awarded to the subject of an independent assessment under the scheme."
    },
    "documentation": {
      "type": "string",
      "format": "uri",
      "description": "A web page providing full documentation of this scheme."
    },
    "licenseType": {
      "type": "string",
      "enum": [
        "proprietary-Code",
        "proprietary-Document",
        "permissive-OpenSource",
        "copyleft",
        "creative-Commons",
        "source-Available",
        "public"
      ],
      "example": "proprietary-Code",
      "description": "Descriptive name and URL link to the license conditions associated with this scheme."
    },
    "establishedDate": {
      "type": "string",
      "format": "date",
      "description": "The date when this scheme was first established.  "
    },
    "geographicScope": {
      "type": "array",
      "items": {
        "$ref": "#/$defs/Classification"
      },
      "description": "The geographic scope of this scheme as a list of ISO-3166 countries, regions, or code=001, name=Worldwide to indicate global coverage."
    },
    "industryScope": {
      "type": "array",
      "items": {
        "$ref": "#/$defs/Classification"
      },
      "description": "A list of UN ISIC code & name indicating the industry scope for this scheme.  "
    },
    "trustmark": {
      "$ref": "#/$defs/Image",
      "description": "The trust mark or seal used by this conformity scheme."
    },
    "conformsTo": {
      "type": "object",
      "properties": {
        "type": {
          "type": "array",
          "readOnly": true,
          "default": ["Link"],
          "items": {
            "type": "string"
          },
          "allOf": [
            {
              "contains": {
                "const": "Link",
                "minContains": 1
              }
            }
          ]
        },
        "linkName": {
          "type": "string",
          "description": "Display name for this link."
        },
        "linkURL": {
          "example": "https://files.example-certifier.com/1234567.json",
          "type": "string",
          "format": "uri",
          "description": "The URL of the target resource.  "
        }
      },
      "required": ["linkName", "linkURL"],
      "description": "The name and URI of the vocabulary standard (eg UNTP CVC) that the machine readable version of this sceme conforms to."
    },
    "includedProfile": {
      "type": "array",
      "items": {
        "type": "object",
        "properties": {
          "type": {
            "type": "array",
            "readOnly": true,
            "default": ["ConformityProfile"],
            "items": {
              "type": "string"
            },
            "allOf": [
              {
                "contains": {
                  "const": "ConformityProfile",
                  "minContains": 1
                }
              }
            ]
          },
          "id": {
            "example": "https://vocabulary.sample-scheme.org/profile/lrap/v1.0",
            "type": "string",
            "format": "uri",
            "description": "Globally unique identifier of this context specific conformity profile. Typically represented as a URI SchemeOwner/profileID URI"
          },
          "name": {
            "example": "Forced labour assessment criterion",
            "type": "string",
            "description": "Name of this conformity profile as defined by the scheme owner."
          }
        },
        "required": ["id", "name"]
      },
      "description": "The list of versioned conformity profiles included in this scheme"
    }
  },
  "description": "A formal governance scheme under which an attestation is issued (eg ACRS structural steel certification) ",
  "required": ["id", "name", "owner", "endorsementLevel", "documentation"],
  "$defs": {
    "Endorsement": {
      "type": "object",
      "additionalProperties": true,
      "properties": {
        "type": {
          "type": "array",
          "readOnly": true,
          "default": ["Endorsement"],
          "items": {
            "type": "string"
          },
          "allOf": [
            {
              "contains": {
                "const": "Endorsement",
                "minContains": 1
              }
            }
          ]
        },
        "name": {
          "example": "Accreditation of certifiers.com under the Australian National Greenhouse and Energy Reporting scheme (NGER).",
          "type": "string",
          "description": "The name of the accreditation."
        },
        "trustmark": {
          "$ref": "#/$defs/Image",
          "description": "The trust mark image awarded by the AB to the CAB to indicate accreditation."
        },
        "issuingAuthority": {
          "type": "object",
          "properties": {
            "type": {
              "type": "array",
              "readOnly": true,
              "default": ["Party"],
              "items": {
                "type": "string"
              },
              "allOf": [
                {
                  "contains": {
                    "const": "Party",
                    "minContains": 1
                  }
                }
              ]
            },
            "id": {
              "example": "https://sample-business-register.gov/123456789",
              "type": "string",
              "format": "uri",
              "description": "Globally unique identifier of this party. Typically represented as a URI identifierScheme/Identifier URI"
            },
            "name": {
              "example": "Sample Company Ltd",
              "type": "string",
              "description": "Legal registered name of this party."
            },
            "registeredId": {
              "example": 90664869327,
              "type": "string",
              "description": "The registration number (alphanumeric) of the Party within the register. Unique within the register."
            }
          },
          "required": ["id", "name"],
          "description": "The competent authority that issued the accreditation."
        },
        "endorsementEvidence": {
          "$ref": "#/$defs/Link",
          "description": "The evidence that supports the authority under which the attestation is issued - for an example an accreditation certificate."
        }
      },
      "description": "The authority under which a conformity claim is issued.  For example a national accreditation authority may authorise a test lab to issue test certificates about a product against a standard. ",
      "required": ["name", "issuingAuthority"]
    },
    "Image": {
      "type": "object",
      "additionalProperties": false,
      "properties": {
        "type": {
          "type": "array",
          "readOnly": true,
          "default": ["Image"],
          "items": {
            "type": "string"
          },
          "allOf": [
            {
              "contains": {
                "const": "Image",
                "minContains": 1
              }
            }
          ]
        },
        "name": {
          "example": "certification trust mark",
          "type": "string",
          "description": "the display name for this image"
        },
        "description": {
          "type": "string",
          "description": "The detailed description / supporting information for this image."
        },
        "imageData": {
          "type": "string",
          "format": "byte",
          "description": "The image data encoded as a base64 string."
        },
        "mediaType": {
          "type": "string",
          "x-external-enumeration": "https://mimetype.io/",
          "description": "The media type of this image (eg image/png)\n\n    This is an enumerated value, but the list of valid values are too big, or change too often to include here. You can access the list of allowable values at this URL:  https://mimetype.io/\n    "
        }
      },
      "description": "A binary image encoded as base64 text and embedded into the data.  Use this for small images like certification trust marks or regulated labels.  Large impages should be external links.",
      "required": ["name", "imageData", "mediaType"]
    },
    "Link": {
      "type": "object",
      "additionalProperties": false,
      "properties": {
        "type": {
          "type": "array",
          "readOnly": true,
          "default": ["Link"],
          "items": {
            "type": "string"
          },
          "allOf": [
            {
              "contains": {
                "const": "Link",
                "minContains": 1
              }
            }
          ]
        },
        "linkURL": {
          "example": "https://files.example-certifier.com/1234567.json",
          "type": "string",
          "format": "uri",
          "description": "The URL of the target resource.  "
        },
        "linkName": {
          "type": "string",
          "description": "Display name for this link."
        },
        "digestMultibase": {
          "example": "abc123-example-digest-invalid",
          "type": "string",
          "description": "An optional multi-base encoded digest to ensure the content of the link has not changed. See https://www.w3.org/TR/vc-data-integrity/#resource-integrity for more information."
        },
        "mediaType": {
          "example": "application/ld+json",
          "type": "string",
          "description": "The media type of the target resource."
        },
        "linkType": {
          "example": "https://test.uncefact.org/vocabulary/linkTypes/dcc",
          "type": "string",
          "description": "The type of the target resource - drawn from a controlled vocabulary "
        }
      },
      "description": "A structure to provide a URL link plus metadata associated with the link.",
      "required": ["linkURL", "linkName"]
    },
    "ScoringFramework": {
      "type": "object",
      "additionalProperties": false,
      "properties": {
        "type": {
          "type": "array",
          "readOnly": true,
          "default": ["ScoringFramework"],
          "items": {
            "type": "string"
          },
          "allOf": [
            {
              "contains": {
                "const": "ScoringFramework",
                "minContains": 1
              }
            }
          ]
        },
        "name": {
          "type": "string",
          "description": "A name for this scoring framework.  Must be unique within a scheme."
        },
        "description": {
          "type": "string",
          "description": "A full text description of the criterion that clearly specifies how compliance is achieved and measured. "
        },
        "score": {
          "type": "array",
          "items": {
            "$ref": "#/$defs/Score"
          },
          "description": "A list of scores and ranks associated with this scoring framework."
        }
      },
      "description": "A scoring framework used for performance level assessments against a criteria or scheme. For example forced labour performance might score A to D depending on the percentage of workforce subject to recruitment fees.",
      "required": ["name", "description", "score"]
    },
    "Score": {
      "type": "object",
      "additionalProperties": false,
      "properties": {
        "type": {
          "type": "array",
          "readOnly": true,
          "default": ["Score"],
          "items": {
            "type": "string"
          },
          "allOf": [
            {
              "contains": {
                "const": "Score",
                "minContains": 1
              }
            }
          ]
        },
        "code": {
          "type": "string",
          "description": "The coded value for this score (eg \"AAA\")"
        },
        "rank": {
          "type": "integer",
          "description": "The ranking of this score within the scoring framework - using an integer where \"1\" is the highest rank."
        },
        "definition": {
          "type": "string",
          "description": "A description of the meaning of this score."
        }
      },
      "description": "A single score within a scoring framework. ",
      "required": ["code"]
    },
    "Classification": {
      "type": "object",
      "additionalProperties": false,
      "properties": {
        "type": {
          "type": "array",
          "readOnly": true,
          "default": ["Classification"],
          "items": {
            "type": "string"
          },
          "allOf": [
            {
              "contains": {
                "const": "Classification",
                "minContains": 1
              }
            }
          ]
        },
        "code": {
          "example": 46410,
          "type": "string",
          "description": "classification code within the scheme"
        },
        "name": {
          "example": "Primary cells and primary batteries",
          "type": "string",
          "description": "Name of the classification represented by the code"
        },
        "definition": {
          "type": "string",
          "description": "A rich definition of this classification code."
        },
        "schemeId": {
          "example": "https://unstats.un.org/unsd/classifications/Econ/cpc/",
          "type": "string",
          "format": "uri",
          "description": "Classification scheme ID"
        },
        "schemeName": {
          "example": "UN Central Product Classification (CPC)",
          "type": "string",
          "description": "The name of the classification scheme"
        }
      },
      "description": "A classification scheme and code / name representing a category value for a product, entity, or facility.",
      "required": ["code", "name", "schemeId", "schemeName"]
    }
  }
}
